{"$defs":{"ActionId":{"maxLength":128,"pattern":"^action-[a-z0-9][a-z0-9-]*$","type":"string"},"AttemptId":{"maxLength":128,"pattern":"^attempt-[a-z0-9][a-z0-9-]*$","type":"string"},"AuthorityId":{"maxLength":128,"pattern":"^auth-[a-z0-9][a-z0-9-]*$","type":"string"},"CanonicalValue":{"anyOf":[{"type":"boolean"},{"type":"integer"},{"type":"string"},{"items":{"$ref":"#/$defs/CanonicalValue"},"type":"array"},{"additionalProperties":{"$ref":"#/$defs/CanonicalValue"},"type":"object"},{"type":"null"}]},"Digest":{"pattern":"^sha256:[0-9a-f]{64}$","type":"string"},"EffectId":{"maxLength":128,"pattern":"^[a-z][a-z0-9-]*$","type":"string"},"EventKind":{"enum":["action_proposed","authority_checked","operation_prepared","attempt_dispatched","attempt_delivered","effect_committed","effect_rejected","response_returned","response_dropped","response_timed_out","response_errored","response_mutated","read_observed","tool_schema_observed","visibility_changed","concurrent_change_applied","fault_fired","state_transition","claim_recorded","containment_blocked"],"title":"EventKind","type":"string"},"EvidenceMap":{"additionalProperties":{"$ref":"#/$defs/CanonicalValue"},"propertyNames":{"$ref":"#/$defs/ParameterName"},"type":"object"},"FaultId":{"maxLength":128,"pattern":"^fault-[a-z0-9][a-z0-9-]*$","type":"string"},"NonNegativeInt":{"minimum":0,"type":"integer"},"OperationKey":{"maxLength":128,"pattern":"^op-[a-z0-9][a-z0-9-]*$","type":"string"},"ParameterName":{"maxLength":64,"pattern":"^[a-z][a-z0-9_]*$","type":"string"},"PositiveInt":{"exclusiveMinimum":0,"type":"integer"},"WorkflowId":{"maxLength":128,"pattern":"^workflow-[a-z0-9][a-z0-9-]*$","type":"string"}},"$schema":"https://json-schema.org/draft/2020-12/schema","additionalProperties":false,"description":"One normalized append-only event record; sequence checks are ledger-owned.","properties":{"action_id":{"anyOf":[{"$ref":"#/$defs/ActionId"},{"type":"null"}],"default":null},"attempt_id":{"anyOf":[{"$ref":"#/$defs/AttemptId"},{"type":"null"}],"default":null},"authority_id":{"anyOf":[{"$ref":"#/$defs/AuthorityId"},{"type":"null"}],"default":null},"effect_id":{"anyOf":[{"$ref":"#/$defs/EffectId"},{"type":"null"}],"default":null},"evidence":{"$ref":"#/$defs/EvidenceMap"},"fault_id":{"anyOf":[{"$ref":"#/$defs/FaultId"},{"type":"null"}],"default":null},"intent_digest":{"anyOf":[{"$ref":"#/$defs/Digest"},{"type":"null"}],"default":null},"kind":{"$ref":"#/$defs/EventKind"},"operation_key":{"anyOf":[{"$ref":"#/$defs/OperationKey"},{"type":"null"}],"default":null},"seq":{"$ref":"#/$defs/PositiveInt"},"tick":{"$ref":"#/$defs/NonNegativeInt"},"workflow_id":{"anyOf":[{"$ref":"#/$defs/WorkflowId"},{"type":"null"}],"default":null}},"required":["seq","tick","kind","evidence"],"title":"LabEvent","type":"object","x-side-effects-lab-schema-version":"0.1"}
